<?xml version="1.0" encoding="UTF-8"?>
<xs:schema xmlns:xs='http://www.w3.org/2001/XMLSchema' xmlns:vc='http://www.w3.org/2007/XMLSchema-versioning' xmlns:gelCAN='https://genomicsengland.co.uk/xsd/cancer/2.0.0' xmlns='https://genomicsengland.co.uk/xsd/cancer/2.0.0' targetNamespace='https://genomicsengland.co.uk/xsd/cancer/2.0.0' vc:minVersion='1.1' elementFormDefault='qualified'>
  <xs:annotation>
    <xs:documentation>
      <h1>ConsentUpdatesCancer</h1>
      <p>Version:2.0.0</p>
      <p>Description:First release of consent update for cancer main programme</p>
      <p>Generated: 2016-01-25T16:48:47.925+0000</p>
    </xs:documentation>
  </xs:annotation>
  <xs:element name='consent-updates'>
    <xs:complexType>
      <xs:sequence>
        <xs:element name='metadata' type='metadata' minOccurs='1' maxOccurs='1' />
        <xs:element name='subject' type='subject-37205.1' minOccurs='1' maxOccurs='unbounded' />
      </xs:sequence>
    </xs:complexType>
  </xs:element>
  <xs:complexType name='metadata'>
    <xs:sequence>
      <xs:element name='schema-name' minOccurs='1' maxOccurs='1'>
        <xs:simpleType>
          <xs:restriction base='xs:string'>
            <xs:enumeration value='ConsentUpdatesCancer' />
          </xs:restriction>
        </xs:simpleType>
      </xs:element>
      <xs:element name='schema-version' minOccurs='1' maxOccurs='1'>
        <xs:simpleType>
          <xs:restriction base='xs:string'>
            <xs:enumeration value='2.0.0' />
          </xs:restriction>
        </xs:simpleType>
      </xs:element>
      <xs:element name='date' type='xs:date' minOccurs='1' maxOccurs='1'>
        <xs:annotation>
          <xs:documentation>
            <p>The date that this file was generated</p>
          </xs:documentation>
        </xs:annotation>
      </xs:element>
      <xs:element name='source-organisation' minOccurs='1' maxOccurs='1'>
        <xs:annotation>
          <xs:documentation>
            <p>ODS code of the source organisation within the GMC sending the message</p>
          </xs:documentation>
        </xs:annotation>
        <xs:simpleType>
          <xs:restriction base='xs:string'>
            <xs:minLength value='1' />
          </xs:restriction>
        </xs:simpleType>
      </xs:element>
      <xs:element name='source-system' type='xs:string' minOccurs='0' maxOccurs='1'>
        <xs:annotation>
          <xs:documentation>
            <p>Source system. Optional but may be used to supply source with information if there are any issues with the submitted XML.</p>
          </xs:documentation>
        </xs:annotation>
      </xs:element>
      <xs:element name='local-report-id' type='xs:string' minOccurs='0' maxOccurs='1'>
        <xs:annotation>
          <xs:documentation>
            <p>Source system report Id. Optional but may be used to supply source with information if there are any issues with the submitted XML.</p>
          </xs:documentation>
        </xs:annotation>
      </xs:element>
    </xs:sequence>
  </xs:complexType>
  <xs:complexType name='subject-37205.1'>
    <xs:sequence>
      <xs:element name='participant-identifiers' type='participant-identifiers-29330.2' minOccurs='1' maxOccurs='1' />
      <xs:element name='consent' type='consent-15009.4' minOccurs='1' maxOccurs='1' />
    </xs:sequence>
  </xs:complexType>
  <xs:complexType name='participant-identifiers-29330.2'>
    <xs:sequence>
      <xs:element name='participant-id' minOccurs='1' maxOccurs='1'>
        <xs:annotation>
          <xs:documentation>
            <p>Participant Identifier (supplied by Genomics England)</p>
          </xs:documentation>
        </xs:annotation>
        <xs:simpleType>
          <xs:restriction base='xs:string'>
            <xs:minLength value='1' />
          </xs:restriction>
        </xs:simpleType>
      </xs:element>
      <xs:element name='date-of-birth' type='xs:date' minOccurs='1' maxOccurs='1'>
        <xs:annotation>
          <xs:documentation>
            <p>The participant&amp;apos;s date of birth</p>
          </xs:documentation>
        </xs:annotation>
      </xs:element>
      <xs:element name='nhs-number' type='nhsnumber-12817.1' minOccurs='1' maxOccurs='1'>
        <xs:annotation>
          <xs:documentation>
            <p>Validated NHS number for participant</p>
          </xs:documentation>
        </xs:annotation>
      </xs:element>
      <xs:element name='chi-number' type='xs:string' minOccurs='0' maxOccurs='1'>
        <xs:annotation>
          <xs:documentation>
            <p>Scottish Community Health Index (CHI) number for participant</p>
          </xs:documentation>
        </xs:annotation>
      </xs:element>
      <xs:element name='surname' minOccurs='1' maxOccurs='1'>
        <xs:annotation>
          <xs:documentation>
            <p>The participant&amp;apos;s surname</p>
          </xs:documentation>
        </xs:annotation>
        <xs:simpleType>
          <xs:restriction base='xs:string'>
            <xs:minLength value='1' />
          </xs:restriction>
        </xs:simpleType>
      </xs:element>
      <xs:element name='forenames' minOccurs='1' maxOccurs='1'>
        <xs:annotation>
          <xs:documentation>
            <p>The participant&amp;apos;s forenames</p>
          </xs:documentation>
        </xs:annotation>
        <xs:simpleType>
          <xs:restriction base='xs:string'>
            <xs:minLength value='1' />
          </xs:restriction>
        </xs:simpleType>
      </xs:element>
    </xs:sequence>
  </xs:complexType>
  <xs:complexType name='consent-15009.4'>
    <xs:sequence>
      <xs:element name='event-details' type='event-details-29940.2' minOccurs='1' maxOccurs='1' />
      <xs:element name='consent-details' type='consent-details-14545.3' minOccurs='1' maxOccurs='20' />
      <xs:element name='date-of-consent' type='xs:date' minOccurs='1' maxOccurs='1'>
        <xs:annotation>
          <xs:documentation>
            <p>Date consent taken</p>
          </xs:documentation>
        </xs:annotation>
      </xs:element>
      <xs:element name='name-and-version-of-consent-form' minOccurs='1' maxOccurs='1'>
        <xs:annotation>
          <xs:documentation>
            <p>Name and Version of form used - list of names and versions available from genomicsengland.co.uk/library-and-resources/</p>
          </xs:documentation>
        </xs:annotation>
        <xs:simpleType>
          <xs:restriction base='xs:string'>
            <xs:minLength value='1' />
          </xs:restriction>
        </xs:simpleType>
      </xs:element>
      <xs:element name='consent-given' type='yesno-12551.3' minOccurs='1' maxOccurs='1'>
        <xs:annotation>
          <xs:documentation>
            <p>Yes no answer to consent given</p>
          </xs:documentation>
        </xs:annotation>
      </xs:element>
      <xs:element name='consent-form' type='xs:string' minOccurs='0' maxOccurs='1'>
        <xs:annotation>
          <xs:documentation>
            <p>File name of uploaded PDF copy of consent form - requested format [ParticipantId]_consent_[TimeStamp].pdf</p>
          </xs:documentation>
        </xs:annotation>
      </xs:element>
      <xs:element name='person-taking-consent' minOccurs='1' maxOccurs='1'>
        <xs:annotation>
          <xs:documentation>
            <p>The full name of the person taking consent</p>
          </xs:documentation>
        </xs:annotation>
        <xs:simpleType>
          <xs:restriction base='xs:string'>
            <xs:minLength value='1' />
          </xs:restriction>
        </xs:simpleType>
      </xs:element>
      <xs:element name='name-and-version-of-participant-information-sheet' minOccurs='1' maxOccurs='1'>
        <xs:annotation>
          <xs:documentation>
            <p>Name and Version of information sheet presented - list of names and versions available from genomicsengland.co.uk/library-and-resources/</p>
          </xs:documentation>
        </xs:annotation>
        <xs:simpleType>
          <xs:restriction base='xs:string'>
            <xs:minLength value='1' />
          </xs:restriction>
        </xs:simpleType>
      </xs:element>
    </xs:sequence>
  </xs:complexType>
  <xs:complexType name='event-details-29940.2'>
    <xs:sequence>
      <xs:element name='event-date' type='xs:dateTime' minOccurs='1' maxOccurs='1'>
        <xs:annotation>
          <xs:documentation>
            <p>Date of the clinical event or observation being reported e.g. date biopsy was taken</p>
          </xs:documentation>
        </xs:annotation>
      </xs:element>
      <xs:element name='event-reference' minOccurs='1' maxOccurs='1'>
        <xs:annotation>
          <xs:documentation>
            <p>Unique identifier for local record of clinical event or observation</p>
          </xs:documentation>
        </xs:annotation>
        <xs:simpleType>
          <xs:restriction base='xs:string'>
            <xs:minLength value='1' />
          </xs:restriction>
        </xs:simpleType>
      </xs:element>
    </xs:sequence>
  </xs:complexType>
  <xs:complexType name='consent-details-14545.3'>
    <xs:sequence>
      <xs:element name='consent-question' minOccurs='1' maxOccurs='1'>
        <xs:annotation>
          <xs:documentation>
            <p>A particular question on a consent form</p>
          </xs:documentation>
        </xs:annotation>
        <xs:simpleType>
          <xs:restriction base='xs:string'>
            <xs:minLength value='1' />
          </xs:restriction>
        </xs:simpleType>
      </xs:element>
      <xs:element name='consent-response' type='yesno-12551.3' minOccurs='1' maxOccurs='1'>
        <xs:annotation>
          <xs:documentation>
            <p>Yes or no response to a particular question on the consent form</p>
          </xs:documentation>
        </xs:annotation>
      </xs:element>
    </xs:sequence>
  </xs:complexType>
  <xs:simpleType name='nhsnumber-12817.1' final='restriction'>
    <xs:restriction base='xs:token'>
      <xs:maxLength value='10' />
      <xs:minLength value='10' />
      <xs:pattern value='[0-9]{10}' />
    </xs:restriction>
  </xs:simpleType>
  <xs:simpleType name='yesno-12551.3' final='restriction'>
    <xs:restriction base='xs:string'>
      <xs:enumeration value='yes'>
        <xs:annotation>
          <xs:appinfo>
            <display-text>Yes</display-text>
          </xs:appinfo>
        </xs:annotation>
      </xs:enumeration>
      <xs:enumeration value='no'>
        <xs:annotation>
          <xs:appinfo>
            <display-text>No</display-text>
          </xs:appinfo>
        </xs:annotation>
      </xs:enumeration>
    </xs:restriction>
  </xs:simpleType>
</xs:schema>