<?xml version="1.0" encoding="UTF-8"?>
<gelCAN:consent-updates xmlns:vc="http://www.w3.org/2007/XMLSchema-versioning"
 xmlns:gelCAN="https://genomicsengland.co.uk/xsd/cancer/2.0.0"
 xmlns:xsi="http://www.w3.org/2001/XMLSchema-instance"
 xsi:schemaLocation="https://genomicsengland.co.uk/xsd/cancer/2.0.0 file:/Users/genomicsengland/Documents/Cancer/MainProgrammeCancer/Cancer%20Schemas%20v2.0.0%20FINAL/ConsentUpdatesCancer-v2.0.0.xsd">
    <gelCAN:metadata>
        <gelCAN:schema-name>ConsentUpdatesCancer</gelCAN:schema-name>
        <gelCAN:schema-version>2.0.0</gelCAN:schema-version>
        <gelCAN:date>2006-05-04</gelCAN:date>
        <gelCAN:source-organisation>source-organisation0</gelCAN:source-organisation>
        <gelCAN:source-system>source-system0</gelCAN:source-system>
        <gelCAN:local-report-id>local-report-id0</gelCAN:local-report-id>
    </gelCAN:metadata>
    <gelCAN:subject>
        <gelCAN:participant-identifiers>
            <gelCAN:participant-id>participant-id0</gelCAN:participant-id>
            <gelCAN:date-of-birth>2006-05-04</gelCAN:date-of-birth>
            <gelCAN:nhs-number>0000000000</gelCAN:nhs-number>
            <gelCAN:chi-number>chi-number0</gelCAN:chi-number>
            <gelCAN:surname>surname0</gelCAN:surname>
            <gelCAN:forenames>forenames0</gelCAN:forenames>
        </gelCAN:participant-identifiers>
        <gelCAN:consent>
            <gelCAN:event-details>
                <gelCAN:event-date>2006-05-04T18:13:51.0</gelCAN:event-date>
                <gelCAN:event-reference>event-reference0</gelCAN:event-reference>
            </gelCAN:event-details>
            <gelCAN:consent-details>
                <gelCAN:consent-question>consent-question0</gelCAN:consent-question>
                <gelCAN:consent-response>yes</gelCAN:consent-response>
            </gelCAN:consent-details>
            <gelCAN:consent-details>
                <gelCAN:consent-question>consent-question1</gelCAN:consent-question>
                <gelCAN:consent-response>yes</gelCAN:consent-response>
            </gelCAN:consent-details>
            <gelCAN:date-of-consent>2006-05-04</gelCAN:date-of-consent>
            <gelCAN:name-and-version-of-consent-form>name-and-version-of-consent-form0</gelCAN:name-and-version-of-consent-form>
            <gelCAN:consent-given>yes</gelCAN:consent-given>
            <gelCAN:consent-form>consent-form0</gelCAN:consent-form>
            <gelCAN:person-taking-consent>person-taking-consent0</gelCAN:person-taking-consent>
            <gelCAN:name-and-version-of-participant-information-sheet>name-and-version-of-participant-information-sheet0</gelCAN:name-and-version-of-participant-information-sheet>
        </gelCAN:consent>
    </gelCAN:subject>
    <gelCAN:subject>
        <gelCAN:participant-identifiers>
            <gelCAN:participant-id>participant-id1</gelCAN:participant-id>
            <gelCAN:date-of-birth>2006-05-04</gelCAN:date-of-birth>
            <gelCAN:nhs-number>0000000000</gelCAN:nhs-number>
            <gelCAN:chi-number>chi-number1</gelCAN:chi-number>
            <gelCAN:surname>surname1</gelCAN:surname>
            <gelCAN:forenames>forenames1</gelCAN:forenames>
        </gelCAN:participant-identifiers>
        <gelCAN:consent>
            <gelCAN:event-details>
                <gelCAN:event-date>2006-05-04T18:13:51.0</gelCAN:event-date>
                <gelCAN:event-reference>event-reference1</gelCAN:event-reference>
            </gelCAN:event-details>
            <gelCAN:consent-details>
                <gelCAN:consent-question>consent-question2</gelCAN:consent-question>
                <gelCAN:consent-response>yes</gelCAN:consent-response>
            </gelCAN:consent-details>
            <gelCAN:consent-details>
                <gelCAN:consent-question>consent-question3</gelCAN:consent-question>
                <gelCAN:consent-response>yes</gelCAN:consent-response>
            </gelCAN:consent-details>
            <gelCAN:date-of-consent>2006-05-04</gelCAN:date-of-consent>
            <gelCAN:name-and-version-of-consent-form>name-and-version-of-consent-form1</gelCAN:name-and-version-of-consent-form>
            <gelCAN:consent-given>yes</gelCAN:consent-given>
            <gelCAN:consent-form>consent-form1</gelCAN:consent-form>
            <gelCAN:person-taking-consent>person-taking-consent1</gelCAN:person-taking-consent>
            <gelCAN:name-and-version-of-participant-information-sheet>name-and-version-of-participant-information-sheet1</gelCAN:name-and-version-of-participant-information-sheet>
        </gelCAN:consent>
    </gelCAN:subject>
</gelCAN:consent-updates>
